cluster_id,cluster_label,size,top_keywords,source_counts,type_counts,silhouette_score
0,intern / internship / intern pros,62,"intern, internship, intern pros, internship pros, interns, cons, pros, good, environment, great","{'glassdoor': 60, 'reddit': 2}","{'review': 60, 'post': 2}",
1,balance / work life / life balance,711,"balance, work life, life balance, life, work, good, cons, balance pros, pros, pros work","{'glassdoor': 710, 'reddit': 1}","{'review': 710, 'post': 1}",
2,management / good / cons,803,"management, good, cons, pros, manager, managers, staff, senior, great, people","{'glassdoor': 797, 'reddit': 6}","{'review': 797, 'post': 4, 'comment': 2}",
3,career / cons / good,825,"career, cons, good, pros, opportunities, great, work, career pros, start, start career","{'glassdoor': 824, 'reddit': 1}","{'review': 824, 'post': 1}",
4,place work / place / work,1158,"place work, place, work, work pros, great place, great, good, good place, cons, pros",{'glassdoor': 1158},{'review': 1158},
5,good / cons / pros,690,"good, cons, pros, good pros, great, pros good, great pros, work, bad, nice",{'glassdoor': 690},{'review': 690},
6,good / cons / pros,865,"good, cons, pros, benefits, work, good pros, pay, great, pros good, people",{'glassdoor': 865},{'review': 865},
7,company / company pros / good,1459,"company, company pros, good, great, good company, great company, company work, work, cons, pros",{'glassdoor': 1459},{'review': 1459},
8,hours / cons / pros,1116,"hours, cons, pros, flexible, work, good, long, working, pros flexible, pay","{'glassdoor': 1114, 'reddit': 2}","{'review': 1114, 'comment': 2}",
9,people / just / capitalism,458,"people, just, capitalism, don, like, money, think, want, class, work","{'reddit': 455, 'glassdoor': 3}","{'comment': 285, 'post': 170, 'review': 3}",
10,just / like / don,670,"just, like, don, think, people, yeah, know, ve, shit, right","{'reddit': 659, 'glassdoor': 11}","{'comment': 572, 'post': 87, 'review': 11}",
11,just / like / workers,455,"just, like, workers, people, employees, don, union, business, work, company","{'reddit': 436, 'glassdoor': 19}","{'comment': 220, 'post': 216, 'review': 19}",
12,team / good / great,593,"team, good, great, cons, pros, work, great team, teams, good team, pros great",{'glassdoor': 593},{'review': 593},
13,just / told / job,653,"just, told, job, boss, work, day, time, like, got, said","{'reddit': 634, 'glassdoor': 19}","{'post': 522, 'comment': 112, 'review': 19}",
14,ibm / sap / oracle,274,"ibm, sap, oracle, cons, work, pros, company, good, ibm pros, great","{'glassdoor': 273, 'reddit': 1}","{'review': 273, 'comment': 1}",
15,company / cons / pros,839,"company, cons, pros, great, good, people, culture, company pros, opportunities, brand","{'glassdoor': 838, 'reddit': 1}","{'review': 838, 'post': 1}",
16,culture / culture pros / work,614,"culture, culture pros, work, work culture, great, cons, good, pros, great culture, culture cons","{'glassdoor': 613, 'reddit': 1}","{'review': 613, 'post': 1}",
17,cons / pros / customers,663,"cons, pros, customers, good, sales, retail, customer, staff, great, assistant","{'glassdoor': 661, 'reddit': 2}","{'review': 661, 'comment': 1, 'post': 1}",
18,environment / environment pros / good,393,"environment, environment pros, good, work, cons, pros, working, working environment, work environment, environment cons","{'glassdoor': 392, 'reddit': 1}","{'review': 392, 'post': 1}",
19,just / job / work,419,"just, job, work, like, don, want, time, ve, feel, working","{'reddit': 415, 'glassdoor': 4}","{'post': 337, 'comment': 78, 'review': 4}",
20,job / good / job pros,665,"job, good, job pros, experience, cons, pros, great, experience pros, work, pros good",{'glassdoor': 665},{'review': 665},
21,salary / good / cons,846,"salary, good, cons, pros, pay, work, pros good, salary pros, low, benefits","{'glassdoor': 845, 'reddit': 1}","{'review': 845, 'comment': 1}",
22,food / free / cons,553,"food, free, cons, pros, free food, pros free, mcdonalds, good, mcdonald, hours","{'glassdoor': 546, 'reddit': 7}","{'review': 546, 'post': 4, 'comment': 3}",
23,job / pay / wage,450,"job, pay, wage, just, work, don, hour, years, time, want","{'reddit': 441, 'glassdoor': 9}","{'comment': 258, 'post': 183, 'review': 9}",
24,place / great / place pros,601,"place, great, place pros, great place, place work, cons, work, pros, good, work cons",{'glassdoor': 601},{'review': 601},
25,pros / cons / people,732,"pros, cons, people, work, good, bad, poor, pay, staff, pros good","{'glassdoor': 731, 'reddit': 1}","{'review': 731, 'post': 1}",
26,learning / good / cons,689,"learning, good, cons, pros, student, great, university, students, work, hours","{'glassdoor': 688, 'reddit': 1}","{'review': 688, 'comment': 1}",
27,cons / pros / work,784,"cons, pros, work, good, great, pros good, pros great, company, technology, environment","{'glassdoor': 779, 'reddit': 5}","{'review': 779, 'comment': 4, 'post': 1}",
28,covid / cons / pros,466,"covid, cons, pros, nhs, work, good, great, support, staff, pandemic","{'glassdoor': 456, 'reddit': 10}","{'review': 456, 'post': 7, 'comment': 3}",
29,audit / cons / pros,493,"audit, cons, pros, good, work, bank, great, accounting, pros good, financial","{'glassdoor': 488, 'reddit': 5}","{'review': 488, 'post': 4, 'comment': 1}",
